{
  "$schema": "../schema-v1.json",
  "schema_version": 1,
  "slug": "ricky",
  "title": "Ricky",
  "versions": [
    {
      "identity": {
        "bundle_identifier": "com.nabilchatbi.Ricky",
        "bundle_version": "2.1",
        "minimum_os_version": "3.0"
      },
      "archive_org": {
        "identifier": "ios-ipa-com.nabilchatbi.ricky",
        "item_url": "https://archive.org/details/ios-ipa-com.nabilchatbi.ricky",
        "bundle_identifier": "com.nabilchatbi.Ricky",
        "bundle_version": "2.1",
        "files": [
          {
            "ipa_filename": "Ricky (v2.1) [Cracked].ipa",
            "md5": "40c78330cc0514344c33306a241494e7",
            "sha1": "bfd083ab0533bc0c9fc2d3ec471456d41eceeac3",
            "sha256": "74380d6f009a43d430fe3bceeccbb1c9d2b20f40a02088688b500b71eb937a5f",
            "tested": true
          },
          {
            "ipa_filename": "Ricky + Level Editor (v2.1) [Decrypted].ipa",
            "md5": "40c78330cc0514344c33306a241494e7",
            "sha1": "bfd083ab0533bc0c9fc2d3ec471456d41eceeac3",
            "sha256": "74380d6f009a43d430fe3bceeccbb1c9d2b20f40a02088688b500b71eb937a5f",
            "tested": false
          }
        ],
        "verification": {
          "state": "content-hash-verified",
          "checked_at": "2026-07-17",
          "notes": "Both Archive.org originals matched the item metadata checksums and are byte-identical. The exact embedded bundle identity was checked before recording this source."
        },
        "availability": {
          "checked_at": "2026-07-17",
          "status": "maintainer-designated-unavailable",
          "notes": "The maintainer designated this build unavailable with no currently marketed App Store alternative. This records project test scope, not a legal conclusion."
        }
      },
      "reports": [
        {
          "id": "2026-07-17-windows-menu",
          "tested_at": "2026-07-17",
          "taphle_commit": "46dce243448bd88c8d23a80b38feba749633d7e9",
          "host": {
            "os": "Windows",
            "os_version": "Windows 11 Pro 10.0.22631",
            "architecture": "x86_64",
            "cpu": "13th Gen Intel Core i7-13700H",
            "gpu": "Intel Iris Xe Graphics, driver 32.0.101.6881"
          },
          "artifact": {
            "archive_ipa_filename": "Ricky (v2.1) [Cracked].ipa",
            "sha1": "bfd083ab0533bc0c9fc2d3ec471456d41eceeac3",
            "verification": "archive-content-hash"
          },
          "status": "menu",
          "booted": true,
          "summary": "Launches on Windows and renders a stable main menu without reproducing the two startup red-black-tree crashes.",
          "milestones": [
            "Completed applicationDidFinishLaunching and applicationDidBecomeActive.",
            "Rendered the Ricky main menu with Story Mode, Custom Levels, and Setting options.",
            "Remained alive at the menu for a controlled 30-second observation."
          ],
          "blocker": "Gameplay, touch input, audio, saving, and network behavior have not yet been validated.",
          "features": {
            "graphics": "partial",
            "audio": "unknown",
            "input": "unknown",
            "saving": "unknown",
            "network": "unknown"
          },
          "notes": "Tested from a clean committed tree using bundled default options only. The window was captured for visual verification and the tester then stopped the process. Automated Windows message injection did not produce an SDL touch event and is not treated as evidence that input is broken."
        },
        {
          "id": "2026-07-17-windows-story-in-game",
          "tested_at": "2026-07-17",
          "taphle_commit": "d9bc6a5d02322f1902e14ba4a451e8b3a4ade2ee",
          "host": {
            "os": "Windows",
            "os_version": "Windows 11 Pro 10.0.22631",
            "architecture": "x86_64",
            "cpu": "13th Gen Intel Core i7-13700H",
            "gpu": "Intel Iris Xe Graphics, driver 32.0.101.6881"
          },
          "artifact": {
            "archive_ipa_filename": "Ricky (v2.1) [Cracked].ipa",
            "sha1": "bfd083ab0533bc0c9fc2d3ec471456d41eceeac3",
            "verification": "archive-content-hash"
          },
          "status": "in-game",
          "booted": true,
          "summary": "Reaches the first playable Story level on Windows through controlled process-scoped foreground input and primes Ricky's packetized MP3 AudioQueue without the prior format error or output-pointer panic.",
          "milestones": [
            "Navigated Story Mode, New Game, PLAY, and both story advances using process-scoped foreground input.",
            "Entered the first playable Story level, was sent a two-second hold on the on-screen right movement control through the verified tapHLE window, and remained alive for approximately 18 seconds after level entry.",
            "Completed the previously failing AudioQueuePrime path after Ricky enqueued its three directly described MP3 buffers; error -66681, MP3 decode warnings, and the non-null output-pointer panic did not recur."
          ],
          "blocker": "Audible audio output and continuity, action buttons, level completion, hazards/death/restart, saving, and long-session behavior of the 0x40-byte allocation quarantine have not been validated.",
          "features": {
            "graphics": "partial",
            "audio": "partial",
            "input": "partial",
            "saving": "unknown",
            "network": "unknown"
          },
          "supersedes": "2026-07-17-windows-menu",
          "notes": "Tested from a clean exact-commit release build after a full Archive.org verification of the IPA immediately before the run, using bundled default options and a 480x320 client. Every input event revalidated that the foreground window belonged to the spawned tapHLE process. A System.Drawing Graphics.CopyFromScreen capture of the OpenGL window returned a black bitmap and was excluded from evidence; it is not evidence of a rendering regression. Audio remains partial because this automated run proved queue decode/prime progress and process survival, not audible output."
        }
      ]
    }
  ]
}
